{
  "id": "version_002",
  "dataset_version": "0.1.0",
  "split": "development",
  "category": "version_filter",
  "query": "AcmeCloud 2.1 的 SSO 入口在哪里？",
  "context": {"tenant_id": "tenant_a", "user_role": "admin", "product": "identity", "version": "2.1"},
  "expected": {
    "answerable": true,
    "relevant_doc_ids": ["identity-sso-guide-v2.1"],
    "relevant_chunk_ids": ["identity-sso-guide-v2.1#c001"],
    "required_facts": ["安全设置", "SSO"],
    "forbidden_facts": ["身份中心"],
    "minimum_citations": 1,
    "expected_refusal_reason": null
  },
  "notes": "显式请求旧版本时允许检索 deprecated 文档。"
}
