{
  "id": "medical_regression_exact_vsm200_config310",
  "dataset_version": "0.2.0",
  "split": "regression",
  "category": "exact_match",
  "query": "CFG-VER-310 在 VSM-200 3.1 上要求哪个配置模板？",
  "context": {"tenant_id": "tenant_a", "user_role": "admin", "product": "pulsecare-vsm200", "version": "3.1"},
  "expected": {"answerable": true, "relevant_doc_ids": ["vsm200-error-codes-fw3.1"], "relevant_chunk_ids": [], "required_facts": ["VSM-200 3.1 配置模板"], "forbidden_facts": ["VSM-100 2.6 配置模板"], "minimum_citations": 1, "expected_refusal_reason": null},
  "notes": "精确型号、错误码和模板。"
}
