{
  "id": "version_003",
  "dataset_version": "0.1.0",
  "split": "development",
  "category": "version_filter",
  "query": "当前稳定版的单点登录入口在哪里？",
  "context": {"tenant_id": "tenant_a", "user_role": "admin", "product": "identity", "version": null},
  "expected": {
    "answerable": true,
    "relevant_doc_ids": ["identity-sso-guide-v2.3"],
    "relevant_chunk_ids": ["identity-sso-guide-v2.3#c001"],
    "required_facts": ["身份中心", "企业登录"],
    "forbidden_facts": ["安全设置"],
    "minimum_citations": 1,
    "expected_refusal_reason": null
  },
  "notes": "未指定版本时只检索 active 文档。"
}
